Category,Cleaned_Text,label,text_length,Extracted_Skills,years_of_experience
Workday,hari krishna summary result oriented professional 6.10 yrs. experience software engineering 3.10 yrs. relevant experience workday consultant. exceptional ability understanding business need improving process. excellent communication skill proven experience working independently well team. involved preparing business requirement document analysis client functional requirements. extensive knowledge complete tenant configuration – supervisory organization role compensation business process configuration supervisory organization job profile position compensation salary plan based different grade grade profile allowance security business processes. day day support workday hcm security compensation reporting issue implementing enhancement needed. created custom report scheduled report requested endusers. worked modifyingtroubleshootingenhancing existing custom report using calculated fields. created used calculated field reporting business process integration within workday. experience performing hcm task like defining job profile position creation employee hiring transfer promotion demotion termination etc. part workday testing requirements. understanding careful analysis internal hr team requirements. setting email notification business process configurations. excellent object management skill workday like configuring supervisorymatrix organization divide organization inactivate organization create subordinates. extensive knowledge hcm org structure like custom organization service center organizations. experience creating job profile job family job family group also worked creation maintenance position job staffing models. experienced workday security related creating assigning user role permissions. involved workday hcm various hr module compensation time tracking security absence management. excellent interpersonal skill strong desire achieve specified goals. support team product backlog grooming activity valuable team player capability share team vision achieve goal deadline work experience working workday consultant ct mar 2019 till date parent company riosoft technology worked workday developer tc aug 2014 feb 2019 education mca jntu university kakinada 2013. technical skill erp system workday peoplesoft workday module core hcm compensation benefit absence management. workday skill integrationseib studio report calculated field business process dashboards. database technology oracle 10g11i operating system msdos window xp 7 window server 2008 unix professional background project1 ncr – workday implementationenhancements mar 2019 –till date ncr corporation mar 2019 till date description ncr corporation formerly national cash register usbased computer hardware software electronics company provides product service enable business connect interact transact customers. main product selfservice kiosk pointofsale terminal automated teller machine check processing system barcode scanner business consumables. also provide maintenance support services. role responsibility understanding analyzing business requirement studying functional documents. responsible data migration legacy system workday using eib. worked workday studio fix integration related issues. built many enterprise interface builder eib’s inbound core connector worker benefit outbound’s create new workday studio program sending aistatement worker document using birt layout. creating custom report per client requirement preparing utp documents. created workday studio inbound studio program load compensation information adp workday. handson experience migrating xslt code report lower tenet sandbox production using object transporter. created eib inbound integration loading employee personal information like emergency contact compensation onetime payment bank account information cost center information. created eib outbound integration written xslt code sending data workday downstream systems. handson experience creating calculated field using different function complete logics. supporting different team uat phase well test factory team integration testing phase. involved call client update work status well clarification any. environment workday hcm workday studio xml web service xslt 2.0 report writer. project2 tc aug 2017 – feb 2019 toyota description toyota motor corporation usually shortened toyota japanese multinational automotive manufacturer headquartered toyota aichi japan. 2017 toyota corporate structure consisted 364445 employee worldwide september 2018 sixthlargest company world revenue. 2017 toyota world secondlargest automotive manufacturer. toyota world first automobile manufacturer produce 10 million vehicle per year done since 2012 also reported production 200millionth vehicle. july 2014 toyota largest listed company japan revenue. role responsibility experienced work workday report writer creating custom integration third party application using workday core connector enterprise interface builder eib. knowledge domain role user based security. using sequence generator generating template validating inbound integration system results. created new integration pull new hire information using core connector worker document transformation us connector integration xml output data source input. creating new business process notification deployment sandbox tenant based designed business flow diagrams. developed several complex integration using workday studio eib. created test data executed test case system testing. created test scenario test case coordinated testing effort stakeholder system uat. day day support workday hcm security payroll benefit compensation reporting issue involved design phase prototyping discussion client. experienced work workday report writer birt tool creating custom integration third party application using workday cloud connect enterprise interface builder eib. created used calculated field reporting business process integration area within workday. environment workday hcm core connecter absent management workday studio xml xslt xpath oxygen xml. project3 catamaran schaumburg il usa catamaran rx aug 2014 –jul 2017 rolesresponsibilities lead daytoday operation peoplesoft technical team including offshore business assignment technical development support issue resolution technical lead fy14 compensation pharma spinoff peoplesoft hcm system ev3 applicant conversion peoplesoft resume parsing integration peoplesoft ensure project team follows methodology selected project produce quality deliverable participated design effort assisting development design specification applying business expertise best business practices. highly experienced peoplesoft manager self service employee self service application environmentpeoplesoft hcm 9.1 people tool 8.51 oracle 11i,3,6772,"['Workday Studio', 'Workday HCM', 'XML']",6.1
Workday,harikrishna akula summary 5.2 year experience around 3.8 year experience workday involving various activity like integration report requirement gathering design development testing golive support phases. good knowledge eib inboundoutbound integration core connector studio report writer calculated fields. created custom report used calculated field necessary creating report core hr benefit payroll finance. researched issue developed workarounds assisted end users. hand experience creating integration eib inboundoutbound cloud connector dt studio xslt. maintained studio integration within organization responsible bug fix debugging integration. extensive experience designing developing conversation integration interface report online customization. commendable knowledge developing application using programming language like xslt xtt etv. proficient understanding hr module like benefit payroll compensation recruiting staffing talent management business process. mass loading data eib inbound integration launching scheduling integration data transfer third party vendor outbound integration. worked technofunctional consultant upgrade peoplesoft 89.09.1 hcm. expertise resolving issue related hris benefit administration. prepared documentation change functionality due upgrade. strong software development life cycle peoplesoft application using application designer page menu people code sqr crystal security process scheduler people tool people codetracing workflow integration broker wsdl component interface file layout. participated project management activity issue resolution interaction implementation team risk management project status reporting. skilled performing gap analysis swot analysis cost benefit analysis feasibility analysis. quick learner strong analytical communication skills. excel building customer relationships. additional information operating system window window linux unix mac. ide workday studio. erp workday peoplesoft. reporting tool sqr crystal report p query xml publisher simple advance matrix composite trending. workday integrating tool eib iloads studio ideweb servicesexchanger xml tool peoplesoft tool people code sqr package visio office suite microsoft excel microsoft word microsoft powerpoint m office 365 share point. currently working workdayconsultant sancus technology pvt ltdpune june 2016 till date. professional experience role workday consultant client touchnet march 2019 present responsibility consulting client variety data integrity identifyresolve issue could impact project scope andor time frame. conducted involved business meeting requirement gathering. created eib’s ccw picofpeci studio. responding query email phones. work third party support define issue case test fix prior deployment. analysed report core connector based business requirement helped developer change do. experience preparing business requirement document brd functional requirement document frd report eib core connectors. responsible administration hris including limited mass update maintenance organization structure job code table configuration system line business requirement regular maintenance routine data entry. creates maintains support variety standard custom report query metric provide business insight human capital data line reporting governance model. tested report eib integration. help post golive activities. update frd report eib core connector according changes. clarified qa team issue reviewed test plan make sure requirement covered script tested properly. environment workday 30 workday report writer workday studio eib cloud connector xmlxslt. role workday integration consultant client slack technology jan 2018 jan 2019 responsibility created integration establishes worker record kronos update record change occur. track worker time attendance workday integration kronos workforce timekeeper. worked different type report eib cc si created inboundoutbound eib receivesend benefit data workday external vendor like wage works. developed fidelity 401k integration using workday studio send employee contribution pretax amount based payroll schedule. worked core connector document transformation etv xtt transformation developed bring daily worker data change workday using studio. experience developing studio integration eib core connectors. provided mentorship design document report integrations. strong knowledge m office include advanced knowledge word advanced excel capabilities. environment workday 2627 core hr benefit hire retire xmlxslt etv xtt workday report writer workday studio eib iload cloud connector. rolepeoplesoft technical consultant client affigent july 2016 september 2017 responsibility involved design customization table panel adding new option using people tools. generated report using sqr crystal. responsible test plan defect report status knowledge transfer documents. uploading test script m excel test director. developed executed sql query fetch data peoplesoft hrms oracle. fetched data analysed bridge database reported deviation. integrated third party hiring application peoplesoft system using component interface program loaded data p table unit tested developed application created test script test case unit testing system testing developed technical specification customization issuesresolutions custom report interface explaining process flow. closely worked functional team resolve defect created uat user acceptance test performed troubleshooting problem area setting hr table serve foundation hr system producing hr reports. finetuned long running batch process efficiently tuning sql’s bringing running time developed modified several sqr environment peoplesoft hcm 9 microsoft sql database people tool 8.5054 sqr application designer people code application engine. education bachelore civil engineering avrsvr college engineeringtechology j n u anandyala.,3,5883,"['Workday Studio', 'XML']",5.2
Workday,hima.mendu career objective continue growing knowledge skill cloudbased hr solution beginning challenging workday assignment would value add organization professional merit. career stream current working workday hcm based production support assignment handling functional integration tickets. growth path working workday consultant accenture hyderabad jan 2018 till date parent company ifact technologies. worked hr executive q venture pvt ltd hyderabad april 2011 dec 2014. maternity leave january 2015 dec 2017. professional summary hr system erp workday knowledge workday functional concept event task business process related core hcm including supervisory organization job position business process compensation. indepth understanding workday hcm component encompassing management hierarchy location organization type like company cost center region matrix organization custom organization etc. proficient workday compensation including eligibility rule setup grade grade profile salary allowance plan bonus stock plan grouping compensation packages. practiced report writer creation calculated field custom reports. skilled simple integration inbound outbound core connector eib. ability building eib outbound integration system get datatransformdeliver model. career stream hr system erp consulting workday workday hcm technofunctional consultant jan 2018 till date organization – accenture hyderabad. client engagement confidential role responsibility creation maintenance workday supervisory organization location position organization type hierarchy assignments. working different staffing model defining hiring restriction position job headcount management. involving enhancement postproduction support activities. workday hcm functional core organization setup business process compensation configuration instance assisting security team configure workday security. integration maintenance modification enterprise interface builder eib. creating custom calculated field different business scenario built condition rule based client requirements. developing complex custom report converting simple advanced report incorporating calculated field using advanced filtering option including grouping outlining deploying related business objects. career stream – hr executive worked hr executive april 2011 dec 2014 organization –q venture pvt ltd hyderabad role responsibility following job responsibility hr executive – recruitment – 1. job description 2. identify competency required 3. identify source hiring 4. interview candidate 5. coordinate interview respective department 6. selected complete documentation. operation 1. joining formalities. 2. handling employee database soft form file management 3. leaf attendance management 4. confirmation performance appraisal performance management 5. exitinterviews employee relation 1. handling query employees. related salary leaf attendance transfer etc. 2. also expected explain various policy strategy benefit employees. 3. expected stop type rumour misleading communications. 4. motivate employee daytoday basis.,3,3075,['Workday HCM'],0.0
Workday,g himaja career objective work towards achieving greater success career hard work consistency ability work others achieve organizational goal aim objectives. professional summary around 3 year erp experience include 2 year workday integration consultant remaining hr. good involvement workday project full life cycle development deployment upgrade integration etc. good knowledge functional workday includes hcm compensation payroll interface business process configuration etc. extensively worked calculated field used developing various custom reports. strong knowledge involved crchange request business requirement building moving change production. good exposure integration inbound outbound payroll interface implementations. good experience workday integration tool connector picofpeci raas eib api reporting document transformation studio xslt html data load etc. third party integration client various vendor like adp etc. worked functional data inbound data load via eib applicant dependent compensation data loads. good experience outbound integration using eib document transformation sending demographic data end vendors. experience getting requirement client sharing work across team. good experience birt generate bonus letter using workday studio. good experience report designing using workday studio. strong knowledge deploy report multiple environment devqaprod using solution. proven communication interpersonal skills. technical skill workday skill workday hcm workday advanced report writer calculated field core connector picof document transformation workday studio eib workday web services. programming language xml xslt xpath web technology soap xml xsd web service wsdl soap xslt. operating system window xpvistawindows78 experience summary worked software engineer thermo fisher scientific june 2018 – till date. education completed degree bsc. computer science v university tirupathi2018. project project support implementation workday hcm client thermo fisher scientific role workday integration consultant role responsibility understanding business requirement studying functional documents. creation advanced custom report end user reporting demographic information.. handson experience creating calculated field using different function complete logics. created eib inbound integration loading employee personal information like emergency contact compensation one time payment bank account information cost center information. created eib outbound integration written xslt code sending data workday downstream systems. modified xslt code per crrequest adding new xslt code different info types. created new outbound integration sending payroll information workday adp payroll system. created workday studio inbound studio program load compensation information adp workday. handson experience migrating xslt code report lower tenant sandbox production using object transporter supporting different team uat phase well test factory team integration testing phase. involved call client update work status well clarification any. project client thermo fisher scientific role hrexecutive role responsibility • handling end end recruitment activities. • uploading profile internal recruitment portal check duplicity profiles. • track open requirements. • discussion business job requirementsplan hire. • decision mode channel hire based requirements. • sourcing profile social network employee reference reference candidate vendor etc • sourcing profile vendor contract hiring requirements. • initial screening shortlist profile interview process. • interview schedule shortlisted candidates. • arrangement logistics interviews. • arrangement panel nontechnical managerial interviews. • interview coordination. • discussion project teambusiness unit requirement initiate sourcing per requirement. • preparing report submitted business. personal information marital status unmarried nationality indian language known english telugu hindi. declaration hereby declare information furnished true best knowledge. faithfully g himaja,3,4054,"['Workday Web Services', 'Workday Studio', 'Workday HCM', 'XML']",3.0
Workday,name j. sumanth royal. professional summary total 5.7 year experience information technology 3.10 year experience workday platform extensive familiarity workday integrations. extensively worked workday data conversion workday integrations. technically proficient customizations enhancement report using various tool like report writer eib core connector dt workday studio. good understanding integration including web service workday architecture business process framework. good experience knowledge inbound outbound integration eib. experienced developing custom report using advanced report matrix trending composite. good working knowledge technology xml xslt soap web services. involved transformation xml xslt presenting data different web services. prioritizing reproducing verifying bug fix different workday integration reports. work experience configuring business process security developing reports. worked creating complex calculated field using single instance lookup related value lookup date field custom report workday hcm. performed validation testing end end testing also involved integration testing. excellent interpersonal communication skill ability work team standalone environment. education b. tech ece nbkrist nellore 2014. technical skill erp report writer calculated field eib workday studio core connector web service document transformation. language xml xslt xpath. operating system window xp 7 8 10. work experience working workday technical consultant fx ab software solution pvt. ltd november 2015 till date. project detail 1 client first solar inc. role workday technical consultant duration oct 2019to till date. description first solar inc. american manufacturer solar panel provider utilityscale pv power plant supporting service include finance construction maintenance endoflife panel recycling. responsibility involved creating inbound integration using workday studio workday soap router component load currency rate workday system. coordinate user uat phase. created new outbound integration sending time correction information workday adp payroll system. modified xslt code per crrequest adding new xslt code different info types. create new workday studio program sending aistatement worker document using birt layout. creating custom report per client requirement preparing utp documents. created workday studio inbound studio program load compensation information adp workday. handson experience migrating xslt code report lower tenet sandbox production using object transporter. created eib inbound integration loading employee personal information like emergency contact compensation one time payment bank account information cost center information. handson experience creating calculated field using different function complete logics. supporting different team uat phase well test factory team integration testing phase. project detail 2 client catalent pharma solution role workday integration consultant duration august 2017 oct 2019. description catalent leading global provider advanced delivery technology development manufacturing solution drug biologics cell gene therapy consumer health products. 85 year serving industry catalent proven expertise superior technology flexible solution right scale help ensure successful product development launch tech transfer reliable global supply. responsibility created custom report like simple advanced report per client requirement shared security groups. worked calculated field create report level global calculated fields. good experience core connector worker work employee demographic build benefit integration account provisioning integrations. created complex inboundoutbound integration using workday studio corecloud connector using eib’s document transformation process. participate integration testing peer testing. developed core connector document transformation integration get change file csv format xml output. used sequence generator generating template validating inbound integration system results. alert notification creation schedule report per user’s request. day day support workday hcm integration reporting issues. project detail 3 client general electric. designation oracle dba. duration nov 2015 aug 2017. responsibility worked oracle dba. description general electric company american multinational conglomerate incorporated new york city head quartered boston. 2018 company operates following segment aviation healthcare power renewable energy digital industry additive manufacturing venture capital finance. installing oracle software. creating oracle databases. performing upgrade database software new release levels. starting shutting database. managing database storage structures. managing user security. managing schema object table index views. making database backup performing recovery necessary. proactively monitoring database health taking preventive corrective action required. monitoring tuning performance.,3,4955,"['Workday Studio', 'Workday HCM', 'XML']",5.7
