Category,Cleaned_Text,label,text_length,Extracted_Skills,years_of_experience
React Developer,uideveloper react j developer name krishna professional summary 3.2 year extensive experience react jsweb developer 1 year experience react j software developer. extensive experience developing web page using html xml cs javascript react j redux json. experience phase sdlc like requirement analysis implementation maintenance extensive experience agile scrum. extensive knowledge developing single page application spas. good expertise analyzing document object model dom layout dom function java script function cascading style across crossbrowser using fire bug developer tool bar. expertise react j framework develop spa. experienced react j working react flux architecture. experienced working redux architecture using complex objectoriented concept improving performance websites. experience using react j component form event key router plus redux animations. expertise video coding using html5 css3 javascript. expertise restful soap web service integrate application application experience frontend development backend system integration. technical skill web technology html css3 xml javascript json react j node.js github. qualification btech jntukakinada university 2016 professional experience experience react j developer 3.2 year experience industry currently working bosch. current project agsp auto guar age solution project role ui developer react j developer responsibility design develop test html5 css3 bootstrap javascript react.js meet accessibility web browser standard website. developed user interface using react j flux spa development. used reactrouter turn application single page application worked using react j component form event key router animation flux concept. used react flux polish data single directional flow. used object oriented programming concept develop ui component could reused across web application. extensively used git version controlling regularly pushed code github. used jira bug tracking system track maintain history bugsissues everyday basis. environment html5 css3 javascript bootstrap react j redux json git hub jira previous project site work project role ui developer react j developer responsibility worked agile scrum development team deliver regular update business team project managers. involved designing web page using html 5 css3 javascript bootstrap react.js redux worked react j virtual dom react view rendering using component contains additional component called custom html tags. implemented various screen front end using react.js used various predefined component npm node package manager redux library. worked using react j component form event key router animation flux concept. responsible react ui architecture. building component library including tree slideview table grid. implemented stable react component standalone function added future pages. used react j tinplating faster compilation developing reusable components. used reactauto complete creating google map location search webpage. environment html5 css3 bootstrap github jenkins.,1,3024,['XML'],3.2
React Developer,uideveloper react j developer name krishna professional summary 3.2 year extensive experience react jsweb developer 1 year experience react j software developer. extensive experience developing web page using html xml cs javascript react j redux json. experience phase sdlc like requirement analysis implementation maintenance extensive experience agile scrum. extensive knowledge developing single page application spas. good expertise analyzing document object model dom layout dom function java script function cascading style across crossbrowser using fire bug developer tool bar. expertise react j framework develop spa. experienced react j working react flux architecture. experienced working redux architecture using complex objectoriented concept improving performance websites. experience using react j component form event key router plus redux animations. expertise video coding using html5 css3 javascript. expertise restful soap web service integrate application application experience frontend development backend system integration. technical skill web technology html css3 xml javascript json react j node.js github. qualification btech jntukakinada university 2016 professional experience experience react j developer 3.2 year experience industry currently working bosch. current project agsp auto guar age solution project role ui developer react j developer responsibility design develop test html5 css3 bootstrap javascript react.js meet accessibility web browser standard website. developed user interface using react j flux spa development. used reactrouter turn application single page application worked using react j component form event key router animation flux concept. used react flux polish data single directional flow. used object oriented programming concept develop ui component could reused across web application. extensively used git version controlling regularly pushed code github. used jira bug tracking system track maintain history bugsissues everyday basis. environment html5 css3 javascript bootstrap react j redux json git hub jira previous project site work project role ui developer react j developer responsibility worked agile scrum development team deliver regular update business team project managers. involved designing web page using html 5 css3 javascript bootstrap react.js redux worked react j virtual dom react view rendering using component contains additional component called custom html tags. implemented various screen front end using react.js used various predefined component npm node package manager redux library. worked using react j component form event key router animation flux concept. responsible react ui architecture. building component library including tree slideview table grid. implemented stable react component standalone function added future pages. used react j tinplating faster compilation developing reusable components. used reactauto complete creating google map location search webpage. environment html5 css3 bootstrap github jenkins.,1,3024,['XML'],3.2
React Developer,curriculum vitae anjani priyadarshini sr. web developer react personal detail dob 05091985 sex female nationality indian city hyderabad objective acquire position company would allow creative keep challenged various web project require employing latest trend technologies. employing passion multitude design work especially online design develop enable constantly learn develop varying area web development. 9 year experience development web application using html 5 sas javascript frame work like angular 2 react j bootstrap materialize css. aspiring career professional organization apply varied thought fulfillment organization objective scale greater height along organization. education completed ba kasturba gandhi college 2005 aggregate 61.26 osmania university. skill set skilled html html5 cs css3 photoshop cs6 dreamweaver cs6 w3c standard xhtml react framework mobile website designsdevelopment illustrator cs6 responsive template design knowledgeable jquery javascript bootstrap framework foundation framework wordpress framework eclipse coreldraw x5 jquery mobile theme mac xcode responsive design work experience company quaqua tavel experience pvtltd. current position sr. web developer duration dec 2017 till date responsibility html responsive web designing react component quality analyst etc. project title – quaqua product role – sr.software engineer team size 3 technology –react html 5 cs 3. description quaqua digital experience platform integrates 360degree virtual reality content global travel tourism industry. strive translate world travel experience captivating 360 video arvr story provide real immersive end end travel experiences. responsibilities. responsible architecture design involved high lowlevel design individual components. responsible setting coding standard application. working team implementing taking charge quality testing. experience working angular 24 module service template directive service dependency injection create spa. hand experience angular cli command line interface. expertise using react j component form event key router concept. worked new feature angular 4 like new else syntax ngtemplates form validators. key challenge worked new frame work support technical lead. website mobile site work experience company purpletalk india p ltd hyderabad current position front end developer ui designer duration dec 2011 oct 2017 responsibility designing web site mobile apps web site application html work responsive browser compatibility ui design etc. project title – ge – knowledge sharing role – sr.ui developer duration – october 2016 – september 2017 team size 4 technology –angular j javascript html 5 cs 3. description group ge internal application consists mobile application web application used view statistic corresponding device requirement. responsibilities. working modify existing code base per client need guiding team work web application. make code review optimize code better maintain performance app. created webparts share point using share point designer key challenge worked new frame work support technical lead. project 2 title – magellan role –module lead duration – feb 2015 –aug 2016 team size 4 technology –css java script web service android io web application. description move beyond traditional delivering behavioral health employee assistance program service specialty health including musculoskeletal cardiac advanced imaging management physical medicine integrated care management health plan employer medicaid medicare federal government. responsibilities. responsible architecture design involved high lowlevel design individual components. responsible setting coding standard application. working team implementing taking charge quality testing. key challenge worked issue related process flow orchestration module entire business depended. main contribution client implementation work handled. implemented per client requirements. also involved code review. played active role mentor group developers. project 3 title – uhcomw role – sr developer duration – march 2013 – feb 2015 team size 6 technology –css java script web service team foundation server 2010. description you’re teen young adult who getting ready live unitedhealthcare omwtm unitedhealthcare way you. you’ll learn take independent. like finding housing getting good job managing money – more. it’s easy. it’s fun. it’s right here. main role generating icon fonts. converting form pdf online generator. unit testing project uploading sever. architecture detail project implemented multilanguages using bootstrap frame work javascript. responsibilities. responsible time delivery client. giving appropriate estimation required project paln. design involved high lowlevel design individual components. responsible setting coding standard application. key challenge performance tuning query created mobile application responsive web site.. main contribution implemented functionality classic website current website decrease maintenance cost application organization. also involved code review. played active role mentor group developers. project – 4 title – option monster role – sr ui developer duration – july 2012 – february 2013 team size 4 technology – html 5 css3 mobile web application jquiry mobile ui description it’s trade marketing . crossplatform app. built jquery mobile framework take write le mantra next level instead writing unique application mobile device o jquery mobile framework allows design single highly branded responsive web site application work popular smartphone tablet desktop platforms. architecture detail project implemented day night based theme roller jquery ui. responsibilities. responsible architecture design involved high lowlevel design individual components. responsible setting coding standard application. key challenge performance tuning queries. also created uiux . designing android io application also responsible view. main contribution also involved design review. played active role mentor group developers. coordinating team. project – 5 title – rockfordfosgate.com role – ui developer duration – dec 2011 – june 2012 team size 2 technology – photoshop c illustrator icon conversion. description rockford fosgate audio fanatic 35 year rockford fosgate made lifestyle product deliver best audio experience car boat recreational vehicles. build car audio subwoofer car speaker car amplifier fit ride music taste design motomarine product element ready solution marine audio motorcycle audio utv audio systems. architecture detail project implemented photoshop designing. logo designing icon creation illustrator. responsibilities. involved designing backend development wireframe supporting design guide lines. developing maintaining project plan. working mentor ensure project meet business need delivery time. main contribution worked unit testing design qc team. design quality highly passionate determined self motivated able work pressure thinking box offer varying style personal quality friendly hardworking willingness learn optimistic hobbiesinterest anything design related technology music making friend hereby declare abovementioned particular true knowledge. place hyderabad date anjani priyadarshini,1,7227,[],9.0
React Developer,kotani durga prasad objective aspirant position organization contribute skill organization’s success synchronize new technology resourceful innovative flexible. professional summary 3.1 year experience software engineer. highly creative web designer front end developer experience working diverse range project small business website large scale website global user base. excellent knowledge html html5 css3 bootstrap frameworks. strong hand experience hand coding web technologies. good knowledge designing developing web page based seo search engine optimization w3c standard crossbrowser compatibility. good knowledge client side programming javascript jquery. working knowledge react js. experience developing fully responsive website using medium query flexible layouts. ability create pixel pixel matching web pages. unmatchable degree creativity well technical production skills. excellent verbal communication skill including ability convey idea information clearly concisely persuasively. flexibility good judgment attention detail essential. education detail b.tech computer science engineering gudlavalleru engineering college. intermediate sri chaitanya junior college. high school viswakavi high school. professional experience working software engineer amaravati tech service vijayawada august 2018 till date. technical skill key skill html5 css3 javascript jquery json bootstrap responsive design. framework react js. o window dev tool microsoft visual studio oﬃce tool microsoft oﬃce suite edit plus notepad project agro service description ecommerce based web application. selling buying agriculture equipment pesticide seeds. providing service client. role responsibility used ui router implementing routing application. implemented validation using predefined validation react j framework. implemented validation using custom directive react js. used http service pagination. overview understanding diﬀerent feature react j like dependency injection digest apply web cycle twoway data binding. done curd operation using resource services. involved development design implementation front end part application. developed user interactive web page professional manner using web technology like html5 css3 per company standards. used bootstrap react j eﬀective web design. responsible creating look feel public website. used ajax json jquery request data response processing. . used broadcast emit share data diﬀerent module interacting customer along various phase project. ui technology used html5 css3 javascript bootstrap jquery react js. map tag description map tag connects people place providing fastest easiest way share direction eliminate wasted time frustration getting lost. online directory service identifying place important home oﬃce business etc. designed mobile use optimized take advantage capability smart phones. map tag hold much information place address. include thing like photo special instruction directional help landmark route guide line contact detail descriptive information course gps coordinate show exact location map. tag private secure controlled map tag owner. individual map tag accessible anyone unless authorized owner. role responsibility html development. fixing alignment issue creating drop menu using jquery. ui technology used html5 css3 javascript bootstrap jquery byron description byron vision serve proper hamburger way be. started oﬀ 2007 london simple thing well properly weren’t restaurant oﬀering hamburger like silver top moment. byron site show menu information including price description dish location information restaurant chain provide news story brand ability sign receive marketing information byron. site built using latest technology experience capable device utilizing html5 transition functionality needed. html5 functionality supported device experience degraded provide usability according device capabilities. role responsibility html development developing drop menu using jquery developing dynamic background using jquery mobile. ui technology used html5 css3 jquery. personal detail nationality indian sex male marital status unmarried language known english hindi telugu declaration hereby declare information furnished true best knowledge belief. date place vijayawada k.durga prasad,1,4274,[],3.1
React Developer,venkatalakshmi pedireddy software developer experience 3 year visakhapatnam india work experience developer schemax expert techno craft pvt. ltd 052018 present visakapatnam achievementstasks worked front end back end responsible development management project education ssc z. p. g. h. school 082011 032012 8.5 cgpa board intermediate ap sri prakash junior college 082012 032014 81.1 b.tech sri prakash college engineering 082014 032018 73.33 skill html html cs cs javascript javascript react j react j mysql mysql nest j nest j personal project purchase management 032021 042021 used tracking purchase pending payment discount based user retailerdistributor corona awareness website 032020 042021 provide awereness covid project material management system 082018 012019 mm tracking procurement material indent transfers. maintain stock material plant technology used yii frame work angular j mysql warehouse management system 022019 032019 wms maintain stock sale purchase dispatch technology used yii frame work angular j mysql board intermediate support 032019 042019 boi support track employee attendance payment employee technology used joomla frame work mysql sale 042019 082020 sale track purchase two wheeler three wheeler transfer branch technology used nx repo react j nest j type orm mysql swagger apparel management 092020 042021 apparel management large project used track order sewing cutting embroidery productivity employee tracking plant technology used nx repo react j nest j type orm mysql swagger enterprice resource planning 052021 present erp used track order packingrm procurement production logistics technology used nx repo react j nest j type orm mysql swagger language telugu native bilingual proﬁciency english full professional proﬁciency learning new technology learning new technologiesinterests,1,1826,[],3.0
React Developer,kambala sai surendra summary project    basic knowledge html cs bootstrap javascript react j redux jquery. good analytical thinking handson react j redux bootstrap. well acquainted version control repository github. mandepeta summary title keeperapp githublink” technology involved html cs javascript react j summary storing note required. adding deleting note procedure created using js. responsibility creating web page using react j html javascript. handling adding deleting note using javascript. project1 title facebook frontend design using react j githublink” technology involved html react j material ui summary part facebook website created using react js. login using valid credential using firebase service backend database. post created using firebase database. responsibility webpage setup scratch. creating different component jsx file project2 education jntu kakinada 2015 – 2018 b.tech computer science engineering obtained percentage 63.80 leela krishna babuji polytechnic ravulapalem 2011 – 2014 diploma computer engineer obtained percentage 68.03 zp high schooltapeswaram 2001 – 2011 matriculation obtained percentage 62 technical proficiency development react j redux html cs bootstrap jquery javascript. ide experience visual studio code vscode. language java. operating system window xp 7810. academic participation appreciated certificate “cyberthon2k18” east godavari conducted “apita”.  worked coordinator college annual fest. participated “paper presentation” “ethical hacking” eprozyne2k15 conducted pragati engineering college. participated “poster presentation” “google glass” eprozyne2k16 conducted pragati engineering college. personal detail date birth 15 mar 1996 language known telugu english sex male declaration hereby solemnly affirm detail provided always true best knowledge belief shall carry manner lends dignity organization worthy enough person.,1,1892,[],0.0
React Developer,mareedu lokesh babu professional overview around 2 year experience software design development implementation maintenance application using html cs javascript jquery php mysql react j node js. knowledge object oriented php programming. knowledge versioning control like git. involved responsive web development using bootstrap. strong analytical problem solving skill presentation skill good team player. work independently. scholastic b.tech computer science engineering. vkr vnb agk college engineering technology gudiwada affiliated jntuk 76.4 2019. technical skill web technology html cs bootstapjavascript jquery php react j node js. database mysql operating system window ide visual studio netbeans code repository tool git web server apache installers xampp project project 1 name rmc redimix concrete duration sept 2019 till team size 5 environment html cs bootstrap mysql react j node js. description product built instant redimix concretermc. product related construction industry supply redimix concrete based customer requirement. . take order customer business mix both.it manages sale stock accounting shipping customer data single place. inventory control improves tracking control inventory activity stock movements. responsibility active participation development timely delivery per deadlines. designed website using html cs . programming coordinating team responsibility include database design code profiling extensive documentation. review perform design validation working client. implemented validation required field dynamically. coordinating team client weekly status calls. .close follow testing team resolving issues. review end user key functionality system work improvement application technically. career profile software developer maganti solutionsvijayawada 5th august 2019 date mareedu lokesh babu place signature,1,1846,[],2.0
React Developer,mareedu lokesh babu professional overview around 2 year experience software design development implementation maintenance application using html cs javascript jquery php mysql react j node js. knowledge object oriented php programming. knowledge versioning control like git. involved responsive web development using bootstrap. strong analytical problem solving skill presentation skill good team player. work independently. scholastic b.tech computer science engineering. vkr vnb agk college engineering technology gudiwada affiliated jntuk 76.4 2019. technical skill web technology html cs bootstapjavascript jquery php react j node js. database mysql operating system window ide visual studio netbeans code repository tool git web server apache installers xampp project project 1 name rmc redimix concrete duration sept 2019 till team size 5 environment html cs bootstrap mysql react j node js. description product built instant redimix concretermc. product related construction industry supply redimix concrete based customer requirement. . take order customer business mix both.it manages sale stock accounting shipping customer data single place. inventory control improves tracking control inventory activity stock movements. responsibility active participation development timely delivery per deadlines. designed website using html cs . programming coordinating team responsibility include database design code profiling extensive documentation. review perform design validation working client. implemented validation required field dynamically. coordinating team client weekly status calls. .close follow testing team resolving issues. review end user key functionality system work improvement application technically. career profile software developer maganti solutionsvijayawada 5th august 2019 date mareedu lokesh babu place signature,1,1846,[],2.0
