Category,Cleaned_Text,label,text_length,Extracted_Skills,years_of_experience
PeopleSoft,anubhav kumar singh core competency scripting shell scripting application peoplesoft hcm financials operating system linux window webapp server weblogic tuxedo rdbms oracle repository github core competency scripting shell scripting application peoplesoft hcm financials operating system linux window webapp server weblogic tuxedo rdbms oracle repository github work globally competitive environment challenging assignment shall yield twin benefit job satisfaction steadypaced professional growth. professional experience 062019 current hcl current role system admin offshore skill shell scripting linux peoplesoft administration github managing peoplesoft hcm peoplesoft fscm production environment along support environment installed linux window os. involved day day activity project migration database refresh system admin change tax update etc. troubleshooting various server like application server web server process scheduler servers. applying tuxedo weblogic middleware cpu patch various applications. working shell scripting used integration method exchange file external system installation troubleshooting 2tier setup per requirement. reviewing vulnerability reported security teams. renewal ssl weblogic. vulnerability remediation whenever vulnerability report rmis team. worked pum peoplesoft update manager installation dpk. working knowledge ansible docker. developing new shell script troubleshooting shell script failures. 072017 062019 techmahindra roleproject application support automationdevops tool peoplesoft admin skill shell scripting linux peoplesoft administration jenkins ansible project 1 people tool 8.55 upgrade hcm 9.2 application upgrade project 2 migration application ntt cloud onpremises aws cloud worked shell scripting various application requirement. working ansible jenkins automated startstop various activity application. basic knowledge docker. applying ssl certificate new released applications. worked elastic search configuration peoplesoft. gained knowledge aws resources.. strong understanding unix architecturecommand trouble shooting unixlinux platform. efficient using configuration management deployment tool like ansible. good experience job scheduling via crontab ibm tivoli workload scheduler tws. good knowledge automation using shell scripting continuous integration management using jenkins installing configuring jenkins. responsible writing ansible playbook perform various task managed administration task installation configuration application troubleshooting performance related issue. applying tuxedo weblogic cpu patch various applications. working vulnerability reported security teams. reviewing platform certification information product platform database server web application server browser product peopletools 8.55. server migration aws amazon web service. installation peoplesoft server component application server process scheduler server tuxedo web logic server new release peopletools unixlinux servers. applying latest patch peopletools. installing configuring change assistant various upgrade passes. creating running peopletools upgrade job peopletools 8.55 upgrade. setting performance monitor. creating new app web process scheduler domain post upgrade new linux severs. troubleshooting common domain boot problems. identifying configuring source target database ca hcm 9.2 application upgrade. working hcm pum images. creating change package using pum applying sourcetarget database per requirement. creating application upgrade job using change assistant. 092015 072017 srdt pvt ltd. srm group roleproject peoplesoft application database admin skill peoplesoft administration weblogic tuxedo app designer pum peopletools upgrade peoplesoft campus application upgrade. maintaining 7 production environment 21 supporting environment installed window server 2008 r2 oracle 11g. posse knowledge experience peoplesoft architecture administering peoplesoft server component application server process scheduler server tuxedo web logic server pia peoplesoft internet architecture integration broker report node application issue technical issues. peoplesoft skill experience migration production support p application exposure applying peoplesoft bundle update change assistant. exposure working window unixlinux environment oracle database. working knowledge integration broker. refreshed testing dev preprod prod environments. experience troubleshooting various server like application server web server process scheduler servers. experienced providing 247 support production development environments. installation database server web server application server peoplesoft application hrms 9.2fscm9.2 cs9.0 c 9.2hrms 9.2 people tool 8.538.54 8.55 installed configured s secure enterprise search hrms instance. experience installing oracle policy automation oracle policy modelling creating opa database existing database oracle implemented single sign peoplesoft applications. implemented peoplesoft interaction hub integrate external content information peoplesoft applications. upgraded people tool 8.53 8.54 campus 9.0production environment. upgraded people tool 8.53 8.55 finance 9.2 testing environment. upgraded application c 9.0 9.2. configured pum peoplesoft update manager every new image. applying tax update bug tailored change package pum. upgraded oracle database 11.2.0.1 11.2.0.4 using dbua. created instance people tool 8.55 provide testing environments. prepared upgrade status report sheets. coordinated provided support offshore projects. imported self signed certificate weblogic provide secure port access instances. set terminal server provide central access people tool technicaldevelopers. created ticket development team followed get resolution error occurred. project client drdo project single sign role peoplesoft admin environment people tool 8.50 hrms 9.1 fscm 9.1 description single signon sso property access control multiple related independent software systems. property user log single id password gain access connected system system without using different usernames passwords. client netapp project support maintenance role peoplesoft adminl2 support environment peopletool 8.49 hrms 8.9 description handled ib related issue. clear process scheduler cache per weekly maintenance process. handled psadmin related activities. 112013 052015 ac personal detail father’s name rajeev kumar singh date birth 11091990 sex male language read write hindi english ready relocate yes education b.tech electrical electronic engineering 2012,0,6543,[],0.0
PeopleSoft,peoplesoft database administrator gangareddy professional objective work professional challenging environment best utilizing talent keeping abreast latest technical advancement field peoplesoft application dba derive utmost job satisfaction knowledge field become successful oracle peoplesoft application dba activities. professional summary 4 year experience peoplesoft application admindba experience creating configuring application server domains. created multiple server domain separate host system access one database effective strategy performance tuning. experience application server administration. ensured system availability implementing failover spreading multiple domain across multiple hosts. peoplesoft server administration expertise installation configuration setup management database peoplesoft internet architecture pia environment related processing objects. extensive experience applying tax update patch fix bundle maintenance packs. experienced peoplesoft application administrator including performance problem sqr report app engine tuning sql index creation migration change management. extensive experience refreshing development qa production database migrating change qa production evaluating required patch applying peoplesoft system timely basis. experience report management monitoring batch environment. peoplesoft server administration expertise installation configuration setup management database peoplesoft internet architecture pia environment related processing objects. experience monitoring scheduling jobs. experience security administration. experience creating managing batch environment. taking scheduled backup per backup strategy using rman. configured maintaining rman take backup oracle sql server database experienced taking regular offline online logical backup experience backup like logical backup exp imp datapump. successfully installed configured oracle s peoplesoft environment. involved configuration ssl certificate weblogic 10.3 12c. successfully installed applied pum peoplesoft update manager. technical skill erp package peoplesoft hrmsfscmcrmcshcmportal 9.0 9.19.2 people tool version peopletools 8.488.508.528.538.548.558.57 application server bea tuxedo 8.1oracle tuxedo 10.312c web server bea weblogic 8.1oracle weblogic 10.312c database oracle 10gr2 11gr2 mssql server 2008r220122014. operating system rhel as4 oel 5.5 oel 6 window 20032008r2. professional experience working emergtech business solution india pvt. ltd may 2017 till date. client amerit fleet solution duration sep 2019till database mssql server 20122014 role peoplesoft administratordba environment peoplesoft hcm fscm crm elm c portal 9.09.1 pt v8.528.538.54 oracle 10g11gr2 12cr1 rhel window 2008 r2 server project kc managed service responsibility successfully installed configured web logic server application server component database server window operating systems. successfully installed configured oracle s peoplesoft environment. involved installation application database environments. involved configuration ssl certificate weblogic 10.3. working daily production development administration activities. perform proactive monitoring. involved supporting team member various projects. successfully applied peoplesoft update managerpum. handled application management task like applying patch fixes. cloning production server testing purpose like applying patch bundles. installed peoplesoft database application nt unix operating system installed configured oracle database updated database applying updatesfixespatches backup timely basis kept record updatesfixespatches configured application server web server batch process scheduler server. configured window development client connect 2tier 3tier database development administration purpose professional experience client db duration may 2017aug 2019 database db2 role peoplesoft administratordba environment peoplesoft fscm pt v8. 8.548.57 db2 rhel window 2008 r2 server project db managed service responsibility configured application server webservers batch process scheduler server. extensively used psadmin utility administer create delete application server process scheduler server. monitored server client queue status several tuxedo domain changed psappsrv.cfgpsprcs.cfg configuration file performance tuning specific environment. checked cleared application server cache regular basis maintenance process. setup trace log various level like logfence parameter domain setting section appsrv.cfg file trace log configuration manager sql people code ae etc enable trace parameter psappserv.cfg psprcs.cfg file application server process scheduler created multiple web logic server instance taking care security related issues. adding additional security group mapping. taking care dr setup snap shot backup. mutli factor authentication setup. monitoring process helping customer term troubleshooting performance gaining. take care migration script executions. document preparation issue troubleshooting step issue occurred.,0,5031,[],4.0
PeopleSoft,classification internal classification internal murali experience summary 6 year experience working peoplesoft administration performing various infrastructure related activity peoplesoft environments. installed configured peoplesoft 9.09.19.2 web server application server database server process scheduler server window unix linux platforms. creating domain web server application server process scheduler server. applied patch manually applied maintenance pack change assistant tool. experience dpks installations. applying tax update fix using pum migrating project one environment another environment using application designer also capi stat tools. performed single sign ssoimplementation. experience running compare report pre post migrations. experience setting client workstation developer testers. involved configuration integration broker setting module sending messages. involved 247 production support client. involved running audit report dddaudit sysaudit integrity checks. experience configuration setup ren server. configured maintained report node settings. checked clear cache servers. involved troubleshooting server like application server web server process scheduler server. worked peopletools upgrade pt8.52 pt8.55 8.55 8.57. installing configuring elastic search 6.1.2 career profile date organization role 22nd mar 2021 – 25th may 2021 l n infotech peoplesoft administrator client sembcorp brazil description project involved active production support field hrms 9.2. additionally also involved maintenance enhancement system. responsibility installation setup people soft hcm elm 9.2 oracle. creating database user assigning role privilege users. maintaining various people soft instances. debugging resolving issue related application serverweb serverprocess scheduler. weeklymonthly database maintains. performed people tool upgrade 8.55.14 8.57.05. performing post refresh activities. date organization role 9th nov 2018 – 19th mar 2021 regency technology peoplesoft administrator client wipro ind platform people tool 8.56 people soft hcm 9.2. description project involved active production support field hrms 9.2. additionally also involved maintenance enhancement system. responsibility installation setup people soft hcm 9.2 oracle. creating database user assigning role privilege users. maintaining various people soft instances. debugging resolving issue related application serverweb serverprocess scheduler. weeklymonthly database maintains. creating modifying data mover scripts. migrating project using capi. applying patches. setting peoplesoft reporting environment reporting. interacting client various production related issues. applying tax update using pum. performing post refresh activities. date organization role 9th nov 2015 – 30th nov 2017 dxc technology formerly known csc peoplesoft administrator project title people soft hcm production support enhancement client asg usa platform people tool 8.528.54 people soft hcm 9.09.2 db2 aix 5.1. description project involved active production support field hrms 9.0. additionally also involved maintenance enhancement system. responsibility installation setup people soft hcm 9.09.1 db2. creating database user assigning role privilege users. maintaining various people soft instances. debugging resolving issue related application serverweb serverprocess scheduler. weeklymonthly database maintains. creating modifying data mover scripts. migrating project using statcapi. applying patches. setting peoplesoft reporting environment reporting. interacting client various production related issues. applying tax update using pum. performing post refresh activities. technology operating system window platform linux erp tool peoplesoft hrms 9.0 peopletools 8.478.48 8.50 8.52 putty sql toad beyond compare. rdbms oracle 10g11g scheduling tool autosys version control tool capi stat language c c sql personal detail date birth 15081982 nationality indian date place hyderabad,0,3970,[],6.0
PeopleSoft,priyanka ramadoss 6146 mountpleasant coonoor nilgiris 643102 career objective excel software professional working learning challenging environment utilize skill knowledge diligence dedication ensure maximum contribution growth organization work for. profile summary adept professional 4.11 year september 2016 present experience peoplesoft admin accenture professional summary peoplesoft administrator september 2016present experience peoplesoft administration finance application. proficient creating configuring peoplesoft component like web server application server process schedulers. active monitoring non production database applications. knowledgeable peoplesoft migration using application designer data mover taking compare report also moving code dev test production environments. usage hp ppm tool well perform peoplesoft migration compare report generation. full life cycle installation peoplesoft environments. pre post database refresh activities. change package creation applying bug fix using change assistant peoplesoft db. proficient administration peoplesoft server component like application server process scheduler webserver. peoplesoft internet architecture good knowledge basic peoplesoft configuration like integration broker setup pum setup ssl file attachment trouble shooting them. hand experience peoplesoft security level activity like creating user profile assigning role permission list. sso login creation user renewing web certificates. performing sox check migration part production release monthly basis. conversant usage controlm v9 tool used creating scheduling jobs. experienced setting batch profile setup server level running controlm job testing production environments. peoplesoft batch monitoring implementation. worked change assistant. experience applying people tool patches. experience creating change packagees target database ca online. experience working unix windows. worked delphix virtual database non production database refreshes. carrying maintenance activity servers. good communication leadership ability problem solving skills. vmware itbm application support associate configuring maintaining infrastructure itbm application window os. worked apache tomcat 7.0.39 7.0.52. vmware itbm 80 82 version window server. ssl configuration complete batch setup window envrironment. handling production non production database itbm tool technology operating system window 200720082012 server r2 solaris server linux red hat version apache tomcat 7.0.39 7.0.52 aws service tool compute storage network database monitoring identity access management project management tool odyssey dashboard odyssey jira service transporter database sql developer peoplesoft people tool 8.55.06 8.55.22 8.57 peoplesoft application fscm 9.22 version reporting p tool application designer data mover delphix virtual database configuration manager change assistant sqr nvision controlm scheduler hp ppm sql developer centrify putty configuration manager key achievement infrastructure support production environment also provide system contingency plans. analyze technical functional aspect supported application troubleshoot problem based requirements. detailed analysis reporting project activities. experience summary organization accenture solution pvt ltd. client credit suisse client description credit suisse group ag global wealth manager investment bank financial service company providing service investment banking provate banking asset management sahred services. responsibility environment administration management financial application. location bangalore duration september 2016 present education course schoolcollege boarduniversity year passing percentage b.e ece sri krishna college engineering technology coimbatore anna university 2016 86 hsc bharathi vidya bhavan erode state board technical education 2012 96.08 school topper s.s.l.c st. joseph’s convent anglo indian girl higher secondary school nilgiris angloindian 2010 93.8 district third personal profile ootacamund ooty tamil nadu district place birth tamil – native english advanced comprehension oral kannada intermediate – oral hindi intermediate sanskrit intermediate language reading book yoga gardening surfing. hobby,0,4233,[],4.11
PeopleSoft,sirazuddin bangalore india sirazuddin bangalore india profile summary overall 6.8 years’ experience peoplesoft administrator. installed peopletools 8.55 scratch including products. experience peopletools 8.51 8.54.08 8.55.07application 9.0 9.2 hrmsfscm. deterministic approach towards problem solving troubleshooting. proficient integration broker. upgraded fscm hcm application peopletools 8.55.07 peopletools 8.54.08. education graduated btech electronics communication engg. m.v.g.r college engineering vizianagaramjntuk aggregate 68.93. achieved 90 mark 12th standard. scored 86 10th standard. achievement awarded bravo 2015 q3 2016 q1 pat back q2 2016 q1 2017 techahindra. awarded associate month award innovator month 1 time. awarded spot pat back capgemini work experience capgemini may’19 – till production support 5 finance environment respective non production environments. project experience project name axa role consultant environment window server 2012 r2 cognizant technol ogy sol ut ion augus 1 8 – april’19 voya financial insurance u client project deal support managing finance applications. project experience project name voya financials role associate environment window server 2012 r2 tech mahindra limit ed july 1 4 augus 18 peoplesoft 9.2 implemented hr fin application. peoplesoft 9.2 implementation project includes 10 peoplesoft application interface thirdparty application interface live production peoplesoft 9.2 environment sdlc. project experience project name role environment cio common software engineer solaris window server 2008r2 responsibility provided administrative support peoplesoft tool version 8.51 8.54 8.55.25 8.56.10 application hrms 9.0 9.2 financialsscm 9.0 9.2 module window unix o creation index table application designer. peoplesoft database setup troubleshooting issue daily peoplesoft admin activity configured peoplesoft application server process scheduler web server domain setup master scheduler. installing oracle tuxedo weblogic java application disk fscm hcm oracle database unix window server scratch installed peopletools 8.55 hcm fscm demo database. upgraded fscm application peopletools 8.55 peopletools 8.54.08. applied patch 8.55.07 fscm configured report nodes. bouncing app web process scheduler clearing cache performed prerefresh post refresh activity database cloning activity. recompilation cobol source code worked project migration using application designer change assistant. applied image 15 16 25 37 fscm 9.2 using pum change assistant. good handson experience application designer data mover change assistant. well aware pia peoplesoft internet architecture. configuring integration broker report node creating udm file transfer interface monitoring deploying gnupg key certificate servers. installed configured elastic search. tool used peopletools 8.54.08 8.56.10 8.55.25 application designer data mover toad sqldeveloper microsoft sql management studio 2014 oracle 11g oracle 12c microsoft sql server 2014 filezilla winscp pcomm tws service silva training certification oracle cloud infrastructure architect associate oracle cloud infrastructure architect professional,0,3152,[],6.8
