Category,Cleaned_Text,label,text_length,Extracted_Skills,years_of_experience
PeopleSoft,peoplesoft administration vivekanand sayana career objective valid expertise 7.5 year peoplesoft hope enhance skill set adding value business enable implementation solution aid company’s objective understanding anticipating need interest motivation client deliver time budget quality delivering value improving agility quality reliability professional summary 7.5 year experience peoplesoft implementation support configuration migration maintenance administration application server domain process scheduler server web server domain peopletools upgrade application update pum s elastic search. experience integration activity various peoplesoft financials hrms epm fscm environments. extensively involved resolving performance issues. experience driving infrastructure hardware upgrade disaster recovery activities. experience health check peoplesoft environment experience peoplesoft database refreshes production development testing environment experience performance tuning application server web server performed 3 full life cycle implementation peoplesoft. implemented peoplesoft internet architecture pia demo test development production instances. experience peoplesoft implementation peopletools 8.56 fscm 9.2 web logic 12.2.1 tuxedo 12.2.2 oracle 12c r2 oracle enterprise linux 7 window 2012 r2. experience peoplesoft installation peopletools 8.55 hcm 9.2 weblogic 12.1.3 tuxedo 12.1.3 people book 8.55 oracle enterprise linux 6 window 2012r2 experience peoplesoft installation peopletools 8.54 hcm 9.2 weblogic 12.1.2 tuxedo 12.1.0 people book 8.54 window 2012 r2 oracle enterprise linux 6. experience peoplesoft installation peopletools 8.53 fscm 9.2 weblogic 10.3.6 tuxedo 10.3 people book 8.53 window 2008 r2 oracle enterprise linux 5.4 experience peoplesoft installation peopletools 8.50 hcm 9.1weblogic 10.3 tuxedo 10.3 oracle 10g r2 people book 8.50 window server 2003 oracle enterprise linux 5. depth experience peoplesoft update manager pum applying peopletools patch application bundle peopletools 8.53 8.54 hrms 9.2 fscm 9.2 application using dpk’s deploy pum latest image dpk’s install middle tier app tier peopletools. depth experience integration broker troubleshooting. proficiency creation configuration administration application server domain process scheduler domain web server domain experience reconfiguration application server domain process scheduler server domain web server domains. experience project migration using application designer data migration using data mover experience generating precompare report post compare report various environments. experience setting client work station developer testers. experience resolving developer issue like resetting password locking unlocking user accounts. maintain workflow peoplesoft users. worked applying patch bundle tax update using change assistant peoplesoft update manager pum installing configuring change assistant apply bundle taxupdates. involved setup configuration integration broker financials hcm applications. maintaining integrity internal consistency database using dddaudit sysaudit alteraudit report periodically. experience load balancing application server domain process scheduler servers. experience clearing cache server application server domain web server domain process scheduler server regular basis. monitor log file find bottleneck status server experience troubleshooting data mover installing peoplesoft. maintaining troubleshooting various server like application server domain process scheduler domain web server domain experience tuning application server domain process scheduler domain web server domains. strong communication collaboration team building interpersonal skill good team player proven individual contributor area technical skill technology tool erp tool people tool 8.568.558.548.538.50change assistant integration broker application designer configuration manager peoplesoft update manager pum s data mover. application peoplesoft hrmsfscmcrm 9.09.19.2 application server tuxedo 8.110.3.612c r112c r2 web server web logic 8.110.312c r112.1.3 operating system window server 2012 r22008 r22003 redhat enterprise linux 56 oracle enterprise linux 5.567 database oracle 10gr211gr212cr112cr2 educational qualification mba hr marketing kbn college nagarjuna university vijayawada 2011. b.sc bachelor science srr cvr college nagarjuna university vijayawada 2009. professional experience worked peoplesoft system administrator capgemini technology service india limited feb 2020 sept 2020. worked peoplesoft system administrator cognizant technology solution india pvt ltd oct 2017 sept 2019. worked associate peoplesoft administrator aa innovative solution pvt. ltd jan 2013 oct 2017. project experience achievement’s client disney fox entertainment allegis environment hcm fscm elm 9.2 people tool 8.56 oracle 12c weblogic 12.2.1 tuxedo 12.2.2 red hat enterprise linux 6. role sr. peoplesoft adminpeoplesoft dba duration feb 2020 sept 2020 role responsibility involved peopletools upgrade peopletools 8.55 8.57 involved application update fscm 9.2.017 fscm 9.2.032 strong experience peoplesoft pum server installation troubleshooting. applying fix patch bundle peoplesoft fscm92 hrms92 using peoplesoft pum. worked intensively performance tuning pia architecture based load testing scaling architecture support expected load created dedicated integration broker gateway message volume high easy maintenance. redesigned configured high availability load balancing existing peoplesoft internet architecture. responsible daily maintenance troubleshooting complex hosted solution monitoring daytoday working system. handled application management task like applying patch fixes. load balancing application server web server performed database refreshes import export backups. object migration different instance involving compare report building object etc. monitoring application server web server process scheduler error check report status blocked queued processing success etc. error log attached check report ran success perform remote call test check integration broker check server disk space load level peoplesoft ping acceptable level status housekeeping activity checking cleaning log daily perform project migration data migrations. generate compare report various environments. checked cleared cache server application server web server process scheduler server regular basis maintenance process. maintain workflow peoplesoft users. download update fix apply environment maintain customizations peoplesoft. download peoplesoft update image apply applications. applied patch tax updates. installed configured change assistant apply pum image. maintaining integrity internal consistency database using dddaudit sysaudit alteraudit report periodically. performed jolt failover load balancing application server domain process scheduler server domains. involved performance database application creating multiple domain across instances. monitor log file find bottleneck status server troubleshoot data mover installing peoplesoft. troubleshooting process scheduler server job stacked queue. maintain troubleshoot various server like application server process scheduler server web servers. involved refreshing peoplesoft instance weekly twice thrice. documenting support issue resolution feedback. client intercontinental hotel group environment fscm 9.2 people tool 8.56 oracle 12c weblogic 12.2.1 tuxedo 12.2.2 red hat enterprise linux 6. role sr. peoplesoft adminpeoplesoft dba duration oct 2017 sept 2019 role responsibility involved peopletools upgrade peopletools 8.54 8.55 involved application update fscm 9.2.006 fscm 9.2.016 strong experience peoplesoft pum server installation troubleshooting. applying fix patch bundle peoplesoft fscm92 hrms92 using peoplesoft pum. perform remote call test check integration broker check server disk space load level peoplesoft ping acceptable level status housekeeping activity checking cleaning log daily perform project migration data migrations. generate compare report various environments. checked cleared cache server application server web server process scheduler server regular basis maintenance process. maintain workflow peoplesoft users. download update fix apply environment maintain customizations peoplesoft. download peoplesoft update image apply applications. applied patch tax updates. installed configured change assistant apply pum image. maintaining integrity internal consistency database using dddaudit sysaudit alteraudit report periodically. performed jolt failover load balancing application server domain process scheduler server domains. involved performance database application creating multiple domain across instance monitor log file find bottleneck status server setup masterslave load balance pubsub service worked intensively performance tuning pia architecture based load testing scaling architecture support expected load created dedicated integration broker gateway message volume high easy maintenance. redesigned configured high availability load balancing existing peoplesoft internet architecture. responsible daily maintenance troubleshooting complex hosted solution monitoring daytoday working system. handled application management task like applying patch fixes. load balancing application server web server performed database refreshes import export backups. object migration different instance involving compare report building object etc. monitoring application server web server process scheduler error check report status blocked queued processing success etc. error log attached check report ran success troubleshoot data mover installing peoplesoft. troubleshooting process scheduler server job stacked queue. maintain troubleshoot various server like application server process scheduler server web servers. involved refreshing peoplesoft instance weekly twice thrice. generating weekly status report support issue delivery manager documenting support issue resolution feedback. client baylor scott white environment hrms 9.2 people tool 8.55 oracle 12c weblogic 12.1.2 tuxedo 12.1.1 red hat enterprise linux 6. role sr. peoplesoft adminpeoplesoft dba duration jun 2013 oct 2017 role responsibility strong experience peoplesoft pum server installation troubleshooting. applying fix patch bundle peoplesoft fscm92 hrms92 using peoplesoft pum. setup masterslave load balance pubsub service worked intensively performance tuning pia architecture based load testing scaling architecture support expected load created dedicated integration broker gateway message volume high easy maintenance. redesigned configured high availability load balancing existing peoplesoft internet architecture. responsible daily maintenance troubleshooting complex hosted solution monitoring daytoday working system. handled application management task like applying patch fixes. load balancing application server web server performed database refreshes import export backups. object migration different instance involving compare report building object etc. monitoring application server web server process scheduler error check report status blocked queued processing success etc. error log attached check report ran success perform remote call test check integration broker check server disk space load level peoplesoft ping acceptable level status housekeeping activity checking cleaning log daily perform project migration data migrations. generate compare report various environments. checked cleared cache server application server web server process scheduler server regular basis maintenance process. maintain workflow peoplesoft users. download update fix apply environment maintain customizations peoplesoft. download peoplesoft update image apply applications. applied patch tax updates. installed configured change assistant apply pum image. perform setup integration broker various environment hrms fscm. maintaining integrity internal consistency database using dddaudit sysaudit alteraudit report periodically. performed jolt failover load balancing application server domain process scheduler server domains. involved performance database application creating multiple domain across instance monitor log file find bottleneck status server troubleshoot data mover installing peoplesoft. troubleshooting process scheduler server job stacked queue. maintain troubleshoot various server like application server process scheduler server web servers. involved refreshing peoplesoft instance weekly twice thrice. generating weekly status report support issue delivery manager documenting support issue resolution feedback.,0,12644,[],7.5
PeopleSoft,arun venu experience summary experience 04 year 08 month multiple peoplesoft upgrade implementation support project fscmhcm global clients. depth knowledge experience working peopletools application engine peoplecode application package file layout exceltoci psquery reporting sqrs bi publisher. worked fscm upgrade includes vanilla compare retrofitting object sit uat go live activities. good experience upgrade implementation modules. good experience phase application development cycle design coding testing maintenance documentation. worked creating custom report using bi publisher sqr p query. worked testing tool ptfpeoplesoft testing framework excellent capability explore learn understand newer business domain technologies. good communication skills. software proficiency skill app package application engine people code sqr bip p query domain knowledge financial service retail healthcare development tool peoplesoft application designer data management data mover integration tool integration broker database oracle 11g 12c working experience currently working peoplesoft technical consultant since december 2016 till date wipro technologies. educational qualification bca computer application guru gobind singh indraparastha university. m.tech software engineering bit pilani wipro wase program. professional experience project tool upgrade 8.58 customer credit suisse domain financial service role hcm technical consultant period feb 2022 – june 2021 description credit suisse group ag global investment bank financial service firm founded based switzerland responsibility analysis customizations es ms page fluid implementation. converting es page fluid. page like name change home mailing address swiss payslip phone number email address emergency contact ethnic groups. converting ms page fluid. data conversion bring attachment previous custom table new fluid delivered table. batch catchup analysis check batch process require catchup golive. worked cutover security document golive. module es ms wa environment peoplesoft hcm 9.2 people tool 8.578.58 project global offboarding automation customer credit suisse domain financial service role hcm technical consultant period july 2020 – jan 2021 description credit suisse group ag global investment bank financial service firm founded based switzerland responsibility created custom ms termination page manager submit resignation behalf direct reportees. created checklist automation program complete checklist item per configuration framework avoid manual check items. created contract expiry reminder process send reminder short term employee whose contract getting expired 30157 2 days. created many bi report generate letter different regions. created custom stakeholder response page creation cutover document golive. provided 247 support warranty period golive. module es ms environment peoplesoft hcm 9.2 people tool 8.57 project end life ptf customer credit suisse domain financial service role financial technical consultant period april 2020 – june 2020 description credit suisse group ag global investment bank financial service firm founded based switzerland responsibility retrofit object like app package app engine page peoplecode sql. worked gl – journal entry journal edit posting journal reversal journals. worked peoplesoft testing framework regression testing gl. module gl environment peoplesoft fscm 9.2 people tool 8.56 project lease administration customer credit suisse domain financial service role financial technical consultant period january 2020 – april 2020 description credit suisse group ag global investment bank financial service firm founded based switzerland responsibility created feed process load lease system file received external source. worked creationmanaging financial operating leases. ran lease process like straightline process depreciation calculate accounting entry depreciation close validated data distln record. worked amendment lease. module lm environment peoplesoft fscm 9.1 9.2 people tool 8.518.56 project labcorp 9.2 upgrade customer laboratory corporation america holding domain healthcare role financial technical consultant period december 2018 – november 2019 description laboratory corporation america holding peoplesoft fscm system 9.1 people tool version 8.51 oracle 11g db. upgraded peoplesoft fscm system 9.2 peopletools 8.56.16 oracle 12c db. responsibility analyzed impacted object need retrofit retrofitted object module peoplesoft 9.2 application. worked customizing fluid page based classic customizations module like gl ap requisition travel expenses. worked classic fluid conversion voucher approval component. worked multiple bug fix reported sit uat phase testing. provided 247 support warranty period golive. module gl ap eprocurement te environment peoplesoft fscm 9.1 9.2 people tool 8.518.56 project bupa nz implementation customer bupa domain healthcare role developer period may 2018 – november 2018 description bupa british international healthcare provisioning multi insurance group responsibility created custom ae interface convert csv file data xml format. created custom ae interface used call psquery fetch data according user parameter create csv. customer data conversion exceltoci load. created custom sqr process ar aging reports. module gl ap ar environment peoplesoft 9.2 peopletools 8.55 project amp idms decommission customer amp service domain financial solution role developer period july 2017 – march 2018 description amp financial service company australia new zealand providing superannuation investment product insurance financial advice banking product including home loan saving accounts. responsibility created new component page grid show conversion data. created new application class efm file transfer according requirement. fixed multiple sit bugs. environment peoplesoft 9.2 peopletools 8.55 project petco support customer petco animal supply inc domain retail role developer period may 2017 – july 2017 description petco animal supply inc. simply petco american pet retailer united state corporate office san diego san antonio. petco sell pet product service well certain type live animal responsibility worked many incident tickets. regular job monitoring. used psquery report development per user requirement. environment peoplesoft hcm 8.80 people tool 8.48. sensitivity internal restricted,0,6376,['XML'],4.0
PeopleSoft,personal detail name pritam biswas date birth 26011996 present location pune experience summary 4.1 year experience development support maintenance upgrade peoplesoft project ibm. currently working peoplesoft implementation project accenture. exposure working finance module hcm module. technical knowledge hand experience people tool version 9.1 9.2 worked peoplesoft hrms application version 8.55 8.58 worked technical aspect creating peoplesoft object like field record page component file layout application engine bi publisher report form etc. worked creating sqrs. worked creating application engine. worked creating bi publisher report. worked creating p query. handson experience generic event mapping. worked peoplesoft job job stream management iws. basic idea control schedule monitor jobs. basic idea service jira phire ticketing tool. skill technical skill technology peoplesoft erp hrms application v 8.x operating system window version till 10 mac o 10.9 10.13 programming language c python beginner peoplecode sqr tool people tool 8.54 8.58 oracle sql developer app designer tectia client servicenow winscp iw control m. database oracle. db2 sql server 2005 reporting tool sqr p query bi publisher industry hcm finance soft skill dedicated work. eager adopt new skills. good communication presentation skill english hindi bengali. interested solving analytical problems. good team player. adopt hazardous situation educational qualification degree institution stream percentage cgpa year passing b.tech national institute technology durgapur electrical engineering 8.41 2017 12th higher secondary burdwan municipal high school pure science includes computer science 82.24 2013 10th secondary burdwan municipal high school subject 87.2 2011 job history ibm india pvt ltd july 2017 may 2020 accenture india june 2020 ti till date professional summary employer client ibm india citigroup finance project peoplesoft production support maintenance tenure october 2017december 2018 responsibility provide technical support provide analysis peoplesoft related issue coming level 2 support team working supporting 6 application crc etl apss citigl cbsi frs. support user directly issue comes. host team meeting update manage status issues. create calendar autosys job batch file run. support green zone production checkouts. make dailyweekly report various application analyze solve problem ticket incident handle servicenow tool create modify incident ticket change request worked full ndm certificate update ndm testing got successful signoff 16 clients. worked dsmt load activity checkout team worked cob test activity provided checkout team. experience monitoring job analyzing failure process monitor app designer sql developer tectia client attend meeting client update behalf team. employer client ibm india axa insurance uprade project peoplesoft hcm development upgrade tenure january 2019september 2019 responsibility assigned axa upgrade team developer upgrading peoplesoft version 9.1 9.2. worked mapping tracing step peoplesoft upgrade project. worked identifying different object like bolton custom peoplesoft modified objects. worked retrofitting peoplesoft object make development environment. worked data reconciliation process every intermediate environment. worked sqr analysis creating p query page record component menu etc. worked batch process running intermediate phase testing purpose. employer client ibm india axa insurance support project peoplesoft hcm enhancement support tenure october 2019present responsibility worked basic enhancement support. worked creating p query created sqr modified sqr. worked job management job scheduling peoplesoft iws. give technical support l2 team. employer client accenture india florida palm project project peoplesoft finance implementation tenure june 2020present responsibility currently working developing interface report workflow form p query bi publisher scratch. worked creating app engine app package component interface multilevel page xml report. supporting resolving service request raised production release. ticket expected resolved within stipulated timeline. mentor associate developer supervise tasks. achievement got acknowledgement client excellent uninterrupted professional support within 6 months. got acknowledged leading yearly cob activity 8 month experience. got manager’s choice award 4 time 2 year 2 projects. got 5 ibmer’s appreciation 2 year 2 projects. awarded eminence excellence award ibm. awarded rising star award ibm. awarded shining star award accenture. recipient central sector scheme scholarship college university year 2013 2014 . recipient dr. b. r. ambedkar medha puraskar 2011 . extra curriculars singing sketching,0,4732,['XML'],4.1
